{
  "content_address": {
    "hash_algorithm": "sha256",
    "inputs": [
      {
        "path": "10_final_script.md",
        "sha256": "a10d854e00cd56e5a55c2809cf59f7eece5da95f5d1716c7c74f3a57e1a04961"
      },
      {
        "path": "10b1_blind_knowledge_inventory.json",
        "sha256": "d4fde2fcf005b90d3d7cb58aec94e6a1ab1a98c658f582c373af7594584924b0"
      },
      {
        "path": "10b2_blind_claim_inventory.json",
        "sha256": "f03c60a3e1ffa3f3ad142d755c9677e0fa1fe389732650936c4cc170a409032e"
      },
      {
        "path": "10b3_blind_naturalness_audit.json",
        "sha256": "5d6b8d835d11198ee559f411f7f20f37f28fe77ff970362227cdb2cbb1d115ab"
      }
    ]
  },
  "knowledge": {
    "core_entities_ungrounded": 0,
    "unmapped_aliases": 0,
    "missing_discovered_nodes": 0,
    "unresolved_concepts": 0,
    "unresolved_dependencies": 0,
    "unresolved_relations": 0,
    "temporal_first_use_failures": 0,
    "confusable_pairs_unresolved": 0,
    "silently_ignored_candidates": 0,
    "invalid_baseline_provenance": 0
  },
  "claims": {
    "missing_claim_sentence_rows": 0,
    "unconserved_claims": 0,
    "unresolved_claims": 0,
    "invalid_evidence_links": 0
  },
  "terminology": {
    "unnecessary_labels": 0,
    "alias_overload": 0
  },
  "narrative": {
    "redundant_reveals": 0,
    "high_load_listening_blocks": 0
  },
  "factual": {
    "unsupported_claims": 0,
    "certainty_overstatements": 0,
    "unsupported_temporal_generalizations": 0,
    "scope_overstatements": 0
  },
  "naturalness": {
    "translationese_flags": 0,
    "repeated_rhetorical_patterns": 0,
    "unresolved_audio_density_flags": 0,
    "unresolved_naturalness_findings": 0
  },
  "proof": {
    "schema_failures": 0,
    "hash_failures": 0,
    "stale_audit_failures": 0,
    "sentence_coverage_failures": 0,
    "candidate_conservation_failures": 0,
    "claim_conservation_failures": 0,
    "finding_conservation_failures": 0,
    "temporal_proof_failures": 0,
    "isolation_failures": 1
  },
  "candidate_conservation_proof": {
    "discovered_candidate_ids": [
      "F001",
      "F002",
      "F003",
      "F004",
      "F005"
    ],
    "dispositions": {
      "F001": {
        "status": "GROUNDED",
        "exact_phrase": "アリイナーゼ",
        "grounding_sentence_id": "S0013"
      },
      "F002": {
        "status": "GROUNDED",
        "exact_phrase": "催涙因子合成酵素",
        "grounding_sentence_id": "S0027"
      },
      "F003": {
        "status": "GROUNDED",
        "exact_phrase": "syn-プロパンチアール-S-オキシド",
        "grounding_sentence_id": "S0035"
      },
      "F004": {
        "status": "GROUNDED",
        "exact_phrase": "反射性の涙",
        "grounding_sentence_id": "S0012"
      },
      "F005": {
        "status": "GROUNDED",
        "exact_phrase": "スルフェン酸",
        "grounding_sentence_id": "S0019"
      }
    }
  },
  "temporal_proofs": [
    {
      "candidate_id": "F001",
      "first_use_sentence_id": "S0013",
      "grounding_mode": "INLINE",
      "grounding_sentence_id": "S0013",
      "ordering_valid": true
    },
    {
      "candidate_id": "F002",
      "first_use_sentence_id": "S0027",
      "grounding_mode": "INLINE",
      "grounding_sentence_id": "S0027",
      "ordering_valid": true
    },
    {
      "candidate_id": "F003",
      "first_use_sentence_id": "S0035",
      "grounding_mode": "INLINE",
      "grounding_sentence_id": "S0035",
      "ordering_valid": true
    },
    {
      "candidate_id": "F004",
      "first_use_sentence_id": "S0012",
      "grounding_mode": "INLINE",
      "grounding_sentence_id": "S0012",
      "ordering_valid": true
    },
    {
      "candidate_id": "F005",
      "first_use_sentence_id": "S0019",
      "grounding_mode": "INLINE",
      "grounding_sentence_id": "S0019",
      "ordering_valid": true
    }
  ],
  "claim_conservation_proof": {
    "discovered_claim_ids": [
      "BC001",
      "BC002",
      "BC003",
      "BC004",
      "BC005",
      "BC006",
      "BC007",
      "BC008",
      "BC009",
      "BC010"
    ],
    "dispositions": {
      "BC001": {
        "status": "SUPPORTED",
        "mapped_claim_ids": [
          "C001"
        ],
        "evidence_ids": [
          "E001"
        ],
        "remaining_issue_types": []
      },
      "BC002": {
        "status": "SUPPORTED",
        "mapped_claim_ids": [
          "C002"
        ],
        "evidence_ids": [
          "E001"
        ],
        "remaining_issue_types": []
      },
      "BC003": {
        "status": "SUPPORTED",
        "mapped_claim_ids": [
          "C003"
        ],
        "evidence_ids": [
          "E002",
          "E003"
        ],
        "remaining_issue_types": []
      },
      "BC004": {
        "status": "SUPPORTED",
        "mapped_claim_ids": [
          "C004"
        ],
        "evidence_ids": [
          "E002",
          "E003"
        ],
        "remaining_issue_types": []
      },
      "BC005": {
        "status": "SUPPORTED",
        "mapped_claim_ids": [
          "C005"
        ],
        "evidence_ids": [
          "E004"
        ],
        "remaining_issue_types": []
      },
      "BC006": {
        "status": "SUPPORTED",
        "mapped_claim_ids": [
          "C006"
        ],
        "evidence_ids": [
          "E005"
        ],
        "remaining_issue_types": []
      },
      "BC007": {
        "status": "SUPPORTED",
        "mapped_claim_ids": [
          "C007"
        ],
        "evidence_ids": [
          "E006"
        ],
        "remaining_issue_types": []
      },
      "BC008": {
        "status": "SUPPORTED",
        "mapped_claim_ids": [
          "C008"
        ],
        "evidence_ids": [
          "E001",
          "E006"
        ],
        "remaining_issue_types": []
      },
      "BC009": {
        "status": "SUPPORTED",
        "mapped_claim_ids": [
          "C009"
        ],
        "evidence_ids": [
          "E004"
        ],
        "remaining_issue_types": []
      },
      "BC010": {
        "status": "SUPPORTED",
        "mapped_claim_ids": [
          "C010"
        ],
        "evidence_ids": [
          "E005",
          "E007"
        ],
        "remaining_issue_types": []
      }
    }
  },
  "naturalness_finding_conservation_proof": {
    "discovered_finding_ids": [],
    "dispositions": {}
  },
  "isolation_status": "ISOLATION_NOT_VERIFIED",
  "content_integrity_status": "PASS",
  "proof_verifier_status": "PENDING",
  "project_status": "PENDING_10D"
}
