{
  "content_address": {
    "hash_algorithm": "sha256",
    "inputs": [
      {
        "path": "10_final_script.md",
        "sha256": "d263be51f9792ba9d419aab4c7a41dabcf61e99fd27484ce2dd6f4ce0eb08d80"
      },
      {
        "path": "10b1_blind_knowledge_inventory.json",
        "sha256": "9a09949972cda03842576cab907b5353946fda8ca6393e696fbcda8504bae1fa"
      },
      {
        "path": "10b2_blind_claim_inventory.json",
        "sha256": "9538cf76af8ebf156572d36d02452ac49bea8b2779d793543365c630585ac319"
      },
      {
        "path": "10b3_blind_naturalness_audit.json",
        "sha256": "28e9def3aecdf899b67a760f66481affc19f4f2755128e40a4b3044d7047f551"
      }
    ]
  },
  "knowledge": {
    "core_entities_ungrounded": 0,
    "unmapped_aliases": 0,
    "missing_discovered_nodes": 0,
    "unresolved_concepts": 0,
    "unresolved_dependencies": 0,
    "unresolved_relations": 0,
    "temporal_first_use_failures": 0,
    "confusable_pairs_unresolved": 0,
    "silently_ignored_candidates": 0,
    "invalid_baseline_provenance": 0
  },
  "claims": {
    "missing_claim_sentence_rows": 0,
    "unconserved_claims": 0,
    "unresolved_claims": 0,
    "invalid_evidence_links": 0
  },
  "terminology": {
    "unnecessary_labels": 0,
    "alias_overload": 0
  },
  "narrative": {
    "redundant_reveals": 0,
    "high_load_listening_blocks": 0
  },
  "factual": {
    "unsupported_claims": 0,
    "certainty_overstatements": 0,
    "unsupported_temporal_generalizations": 0,
    "scope_overstatements": 0
  },
  "naturalness": {
    "translationese_flags": 0,
    "repeated_rhetorical_patterns": 0,
    "unresolved_audio_density_flags": 0,
    "unresolved_naturalness_findings": 0
  },
  "proof": {
    "schema_failures": 0,
    "hash_failures": 0,
    "stale_audit_failures": 0,
    "sentence_coverage_failures": 0,
    "candidate_conservation_failures": 0,
    "claim_conservation_failures": 0,
    "finding_conservation_failures": 0,
    "temporal_proof_failures": 0,
    "isolation_failures": 1
  },
  "candidate_conservation_proof": {
    "discovered_candidate_ids": [
      "F001",
      "F002",
      "F003",
      "F004"
    ],
    "dispositions": {
      "F001": {
        "status": "GROUNDED",
        "exact_phrase": "alliinase",
        "grounding_sentence_id": "S0013"
      },
      "F002": {
        "status": "GROUNDED",
        "exact_phrase": "synthase du facteur lacrymogène",
        "grounding_sentence_id": "S0028"
      },
      "F003": {
        "status": "GROUNDED",
        "exact_phrase": "syn-propanéthial-S-oxyde",
        "grounding_sentence_id": "S0036"
      },
      "F004": {
        "status": "GROUNDED",
        "exact_phrase": "larmes réflexes",
        "grounding_sentence_id": "S0012"
      }
    },
    "discovered_count": 4,
    "baseline_known_count": 0,
    "grounded_count": 4,
    "replaced_count": 0,
    "removed_count": 0,
    "unresolved_count": 0,
    "equation_valid": true,
    "missing_candidate_ids": [],
    "duplicate_disposition_ids": []
  },
  "temporal_proofs": [
    {
      "candidate_id": "F001",
      "first_use_sentence_id": "S0013",
      "grounding_mode": "INLINE",
      "grounding_sentence_id": "S0013",
      "ordering_valid": true
    },
    {
      "candidate_id": "F002",
      "first_use_sentence_id": "S0028",
      "grounding_mode": "INLINE",
      "grounding_sentence_id": "S0028",
      "ordering_valid": true
    },
    {
      "candidate_id": "F003",
      "first_use_sentence_id": "S0036",
      "grounding_mode": "INLINE",
      "grounding_sentence_id": "S0036",
      "ordering_valid": true
    },
    {
      "candidate_id": "F004",
      "first_use_sentence_id": "S0012",
      "grounding_mode": "INLINE",
      "grounding_sentence_id": "S0012",
      "ordering_valid": true
    }
  ],
  "claim_conservation_proof": {
    "discovered_claim_ids": [
      "BC001",
      "BC002",
      "BC003",
      "BC004",
      "BC005",
      "BC006",
      "BC007",
      "BC008"
    ],
    "dispositions": {
      "BC001": {
        "status": "SUPPORTED",
        "mapped_claim_ids": [
          "C001"
        ],
        "evidence_ids": [
          "E001"
        ],
        "remaining_issue_types": []
      },
      "BC002": {
        "status": "SUPPORTED",
        "mapped_claim_ids": [
          "C002"
        ],
        "evidence_ids": [
          "E001"
        ],
        "remaining_issue_types": []
      },
      "BC003": {
        "status": "SUPPORTED",
        "mapped_claim_ids": [
          "C003"
        ],
        "evidence_ids": [
          "E002",
          "E003"
        ],
        "remaining_issue_types": []
      },
      "BC004": {
        "status": "SUPPORTED",
        "mapped_claim_ids": [
          "C004"
        ],
        "evidence_ids": [
          "E002",
          "E003"
        ],
        "remaining_issue_types": []
      },
      "BC005": {
        "status": "SUPPORTED",
        "mapped_claim_ids": [
          "C005"
        ],
        "evidence_ids": [
          "E004"
        ],
        "remaining_issue_types": []
      },
      "BC006": {
        "status": "SUPPORTED",
        "mapped_claim_ids": [
          "C006"
        ],
        "evidence_ids": [
          "E005"
        ],
        "remaining_issue_types": []
      },
      "BC007": {
        "status": "SUPPORTED",
        "mapped_claim_ids": [
          "C007"
        ],
        "evidence_ids": [
          "E006"
        ],
        "remaining_issue_types": []
      },
      "BC008": {
        "status": "SUPPORTED",
        "mapped_claim_ids": [
          "C008"
        ],
        "evidence_ids": [
          "E001",
          "E006"
        ],
        "remaining_issue_types": []
      }
    }
  },
  "naturalness_finding_conservation_proof": {
    "discovered_finding_ids": [],
    "dispositions": {}
  },
  "isolation_status": "ISOLATION_NOT_VERIFIED",
  "content_integrity_status": "PASS",
  "proof_verifier_status": "PENDING",
  "project_status": "PENDING_10D"
}
